img,title,text,refText,link
https://cdn.statsroyale.com/images/cards/full/goblins.png,Гоблины,"Четверо быстрых воинов ближнего боя без брони. Маленькие, шустрые, зеленые и очень вредные!",Какое то предложение,https://statsroyale.com/ru/card
https://cdn.statsroyale.com/images/cards/full/witch.png,Ведьма,"Призывает скелетов, выпускает смертоносные лучи и обладает сияющими розовыми глазами, которые, к сожалению, не стреляют лазерами.",Какое то предложение,https://statsroyale.com/ru/card
https://cdn.statsroyale.com/images/cards/full/miner.png,Шахтер,"Шахтер перемещается под землей и появляется где угодно на арене. Дело не в магии, дело в лопате. Наносит пониженный урон королевским башням.",Какое то предложение,https://statsroyale.com/ru/card
https://cdn.statsroyale.com/images/cards/full/electro_dragon.png,Электродракон,"Изрыгает электрические молнии, поражающие до трех целей. Вдобавок страдает синдромом среднего ребенка.",Какое то предложение,https://statsroyale.com/ru/card
https://cdn.statsroyale.com/images/cards/full/hog_rider.png,Всадник на кабане,"Быстрый воин ближнего боя, атакующий здания и способный перепрыгнуть реку. Он следует зову заклинания «Всадник на кабане» через всю арену.",Какое то предложение,https://statsroyale.com/ru/card